dialect,standard,response
"하나 틀린 거 닮덴 , 한문 . 거 시험 본 거 다 적어 와서라 . 지 아방이 와 일학년이 이런 걸 다 보나 ? 첨 , 벨놈으 세상 다 나왓저 . 게난 그 손지가 허는 말이 하나 틀령 이점 감점 뒛젠 . 구십팔점 나올 거우덴 . 거 어떵사 헌디 요즘 아이덜 막 벨라져 .","하나 틀린 거 같다고 , 한문 . 그거 시험 본 거 다 적어 왔더라 . 자기 아버지가 와 , 일학년이 이런 걸 다 보나 ? 참 , 별놈의 세상 다 나왔다 . 그러니까 그 손자가 하는 말이 하나 틀려서 이점 감점 됐다고 . 구십팔점 나올 거라고 . 그거 어떻게야 하는지 요즘 아이들 막 바라져 .","하나 틀린 거 있댄데 , 한문 . 시험 본 거 다 적어 왔더라 . 지금 일학년이 이런 걸 다 보나 ? 처음에는 벨머리가 세상 다 나왔어 . 그런데 그 손지가 하는 말이 하나 틀렸다고 감점 받았어 . 구십팔점 나올 거였는데 . 그 어떻게 해야 할까요 ? 요즘 아이들 막 벨쩌니까 ."
예 . 볼목리에선 ᄎᆞᆯ레가 뭐꽈 ? ᄎᆞᆯ레 .,예 . 보목리에서 ᄎᆞᆯ레가 뭡니까 ? ᄎᆞᆯ레 .,예 . 볼목리에서는 철하나 뭐예요 ? 철하나 .
잇지 안우꽈 ? 건 것도 계 .,있지 않습니까 ? 건 것도 계 .,있잖아요? 있던 것도 계시죠.
"옛날에 차반지 , 큰 차반지덜 헤영 , 그것에 놔근에 질루주게 .","옛날에 채반 , 큰 채반들 해서 , 그것에 노서 기르지 .","옛날에 차반지 , 큰 차반지들이 있었는데요 , 그것을 농사할 때에 질러주던 거예요 ."
"엇어예 . 구월덜 넘어가쿠다 . 백로 상강이 이신게 , 이때는 .","없어요 . 구월 넘어가겠습니다 . 백로 상강이 있네요 , 이때는 .","없어요. 구월달 넘어가기 전이예요. 백로 상강이 이신 분이시네요, 그때는요."
"아 , 칠성젠 어떵 허여 ?","아 , 칠성젠 어떻게 해 ?","아, 칠성이는 어떻게 되나요?"
홍세함 그거는 누가 허느냐 허면 .,함 그거는 누가 하느냐 하면 .,홍세함이라는 것은 누가 말하는 것이냐에 따라 달라진다.
그 전이는 ᄎᆞᆫ혹헹 멘들안 .,그 전에는 찰흙으로 만들었어 .,그 전에는 진솔히 말해 많이 어려웠습니다.
"찢이면은 , 이것이 애기 이제 옷이엔 하면은 이거 영 헤근에 앞판 뒤판 아니 ?","찢으면 , 이것이 아기 이제 옷이라고 하면 이거 이렇게 해서 앞판 뒤판 아니 ?",찢으면 이거 애기 옷이었으면 앞판 뒤판이 아니겠어요 ?
"유월절 . 유월절 전의 . 옛날에는 유월절 전의 갈앗수다 . 유월 메칠날 유월 칠 일날 , 유월절 박아논 거 아니라 유월절이 그 유월절 전의 갈앗수다 . ᄒᆞᆫ 삼일 전이라도 ᄒᆞ를 전이라도 유월절 전의 .","유월절 . 유월절 전에 . 옛날에는 유월절 전에 갈았습니다 . 유월 며칟날 , 유월 칠 일날 , 유월절 박아논 거 아니라 유월절이 그 유월절 전에 갈았습니다 . 한 삼일 전이라도 유월절 전에 .","여름철 말이야 . 여름철 전의 . 옛날에는 여름철 전의 걸 갔었어 . 여름 초일날 여름 일곱 일날 , 여름철에 밭에 있는 거 아니라 여름철 전의 것을 갔었어 . 한 삼일 전이라도 둘 전이라도 여름철 전의 것을 갔었어 ."
"응 , 웨가칩이서 갈아나고 요디 우리 친정은 수망린디 안 갈안 .",응 외갓집에서 갈았었고 요기 우리 친정은 수망린데 안 갈았어 .,"응 , 웨가칩에서 바꿔도 되고 요디 우리 친정은 수망리에서도 안 갈 거예요 ."
"저 수박은 . 수박도 지금으로부터 나는 거 , 지금이 한 오월 경 , ᄉᆞ월 말일에 저거 놓기 시작헌다 . 오월 초로구나 , 오월 초 .","저 수박은 . 수박도 지금으로부터 나는 거 , 지금이 한 오월 경 , 사월 말일에 저거 놓기 시작한다 . 오월 초로구나 오월 초 .","그 수박은 . 수박도 지금부터 나는 거야 , 지금이 한 5월 경 , 5월 말일에 그걸 놓기 시작하겠지 . 5월 초로 보면 돼 , 5월 초 ."
하여튼 고네할미는 잘 나 .,하여튼 달개비는 잘 나 .,어쨌든 우리 할머니는 잘 계시네요.
게난 어머니는 협재로 가도 물질 이런 거 안 하고 농사만 지엇고예,그러니까 어머니는 협재로 가도 물질 이런 거 안 하고 농사만 지었고요 ?,우리 어머니는 협재로 가도 물질 이런 거 안 하고 농사만 지었습니다.
그건 여자 칩이지예 ? 건 .,그건 여자 집이지요 ? 건 .,그건 여자 친구잖아 ? 건.
ᄂᆞᆷ이 쉐든 ᄂᆞᆷ이 ᄆᆞᆯ이든 막 방목헹 내불민 게 .,남의 쇠든 남의 말이든 막 방목을 해서 내버리면 .,노랑이든 검정이든 막 상관없이 입는 게 좋아.
"아니 , 나는 나는 ᄄᆞᆫ 디 강 살고 , 집 상 강 ᄄᆞᆫ 디 강 살고 .","아니 , 나는 딴 데 가서 살고 집 사서 가서 딴 데 가서 살고 .","아니죠 , 저는 저는 강가에 살고 , 집 상 강가에 살고요 ."
ᄒᆞᆫ 집이 못 사는 사름 많아 .,한 집에 못 사는 사람 많아 .,건 집이 못 사는 사람이 많아.
"우리도 베 서도양 , 우리 아이덜 두건 백 개 사단 , 다 사단 .","우리도 베 있어도요 우리 아이들 두건 백 개 사다가 , 다 사다가 .","우리도 베서도 양 , 우리 아이들에게 백 개씩 산다 , 다 산다 ."
경허단에 안 판관도 안뒈고 .,그러다가 안 판관도 안되고 .,그냥 일이 안 풀리니까 망관도 못 했고.
"경허주게 , 경헌디 그 ᄉᆞ삼사건 후에 저 산 고지 간에 이젠 숫을 묻엇주 . 묻으난 허가 잘 아이 마탓젠 .","그렇지 , 그런데 그 사삼사건 후에 저 산 숲에 가서 이젠 숯을 묻었지 . 묻으니까 허가 잘 안 받았다고 .","경험 적으로 , 경험한 그 사건 후에 저 산 고지 간에 이제 숫을 심어 주었어 . 심은 건 내가 잘 아는데 말야 ."
"으 , 다간 날 때 다 사레 온다 . 두 설 뒐 때 사레 오면 거 ᄑᆞᆯ고 . 겨고 주로이 그 밧갈쉐라고 잇저 , 밧갈쉐 .","으 , 두습 될 때 다 사러 온다 . 두 살 될 때 사러 오면 거 팔고 . 그리고 주로 그 밧갈쉐라고 있어 , 밧갈쉐 .","으, 다음 날에 다 사러 온다. 두 설 뒤에 사러 오면 거 둘러. 그리고 주로이 그 밭갈쑤라고 하는데, 밭갈쑤."
"아 , ᄆᆞ루 대예 . 가운데 들어가는 건 . 아 그럼 세 개 만드는 건 똑같은 거라예 ? 아까 저기 ?","아 , 마루 대요 . 가운데 들어가는 건 . 아 그럼 세 개 만드는 건 똑같은 거지요 ? 아까 저기 ?","아 , 그렇게요 . 가운데 들어가는 건 . 아 그럼 세 개 만드는 건 똑같은 건가요 ? 아까 저기 ?"
"밥 , 식은밥을 헤 가지고 거기 놔 가지고이 이제 누르뜨난 경 뒈엇젠 .","밥 , 찬밥을 해 가지고 거기 놔 가지고 이제 누르니까 그렇게 되었다고 .","밥 , 식은밥을 가져가서 거기 놓고 이제 누르니까 경 뒀어요 ."
바당에 정 강 컷다근에 .,바다에 지어서 가서 잠갔다가 .,바닷가에서 정어리 잡았다가요 .
아 이듸 이듸 자리젓만 헹 먹언 . 자리젓 .,아 여기 여기 자리젓만 해서 먹었어 . 자리젓 .,아 이러다가 자리잡기만 하네 . 자리잡기.
"예 , 예 . 맞수다 . 보통 ᄎᆞᆯ레 옛날에 셍각 한 번 헤봅서 . ᄎᆞᆯ레 뭐 , 뭐 ᄎᆞᆯ령 먹엇수과 ? ᄎᆞᆯ레들 .","예 , 예 . 맞습니다 . 보통 반찬 옛날에 생각 한 번 해보십시오 반찬 뭐 , 뭐 차려서 먹었습니까 ? 반찬들 .","예, 맞아요. 보통 저희는 옛날에 새우각 한 번 해봤는데요. 새우각이란게 뭐였더라고요? 새우들."
"무신걸로 멘든 거라 , 그건 ?","무엇으로 만든 거야 , 그건 ?",무신경으로 만든 거라는 거죠 ?
사혼이엔 허믄 남자도 죽고 여자도 죽고 다헤근엥 헤주 . 구신으로 데 로오는 건데 .,사혼이라고 하면 남자도 죽고 여자도 죽고 다해서 하지 . 귀신으로 데려오는 건데 .,사혼에서는 남자도 죽고 여자도 죽고 모두 다 해주셔야 합니다 . 구신으로 가는 건데 .
또 ᄌᆞᆫ 자리 ᄒᆞᆯ 떼는 그보단 약허게 놓고 .,또 조그마한 자리 할 때는 그보다는 약하게 넣고 .,또 진지한 자리에서는 뜰 때는 그보다는 약하게 놓아야죠.
